{
  "$schema": "https://json-schema.org/draft/2020-12/schema",
  "$id": "https://its.solutionsmith.org/safety_portal/forms/meta-schema.json",
  "title": "Safety Portal form definition",
  "description": "The single source of truth for ONE safety form, consumed by BOTH renderers: the TS portal display runtime (on-screen fill) and the Python reportlab PDF renderer (render-parity). One JSON file per form/variant under safety_portal/forms/. Fields/sections are transcribed faithfully from the source PDF in safety_portal/reference_forms/ — no invention.",
  "type": "object",
  "additionalProperties": false,
  "required": ["form_code", "parent_form_code", "form_name", "version", "archetype", "source_pdf", "sections"],
  "properties": {
    "form_code": { "type": "string", "description": "Stable unique key (e.g. 'jha-v1'); the catalog variant row's rendering contract." },
    "parent_form_code": { "type": "string", "description": "The form-type parent (e.g. 'jha', 'equipment-preinspection'); drives the form-type dropdown." },
    "form_name": { "type": "string" },
    "variant_label": { "type": ["string", "null"], "description": "3rd-picklist label (e.g. 'Telehandler/Forklift'); null when the parent has no variants." },
    "version": { "type": "integer", "minimum": 1 },
    "archetype": { "type": "string", "enum": ["rows_signatures", "grouped_checklist", "content_signin", "visitor_rows", "sectioned_assessment"] },
    "source_pdf": { "type": "string", "description": "Reference PDF filename in safety_portal/reference_forms/ this definition was transcribed from." },
    "comment": { "type": "array", "items": { "type": "string" }, "description": "Maintainer notes, never rendered by either renderer — e.g. a dated operator-directed deviation from the source PDF (daily-report-v3, 2026-07-02). The form editor does not carry this forward when composing a new version." },
    "branding": {
      "type": "object", "additionalProperties": false,
      "properties": { "logo": { "type": "boolean" }, "title": { "type": "string" } }
    },
    "sections": { "type": "array", "minItems": 1, "items": { "$ref": "#/$defs/section" } }
  },
  "$defs": {
    "input": { "type": "string", "enum": ["text", "textarea", "date", "time", "number", "select", "signature", "photo"] },
    "field": {
      "type": "object", "additionalProperties": false,
      "required": ["key", "label", "input"],
      "properties": {
        "key": { "type": "string" }, "label": { "type": "string" },
        "input": { "$ref": "#/$defs/input" },
        "options": { "type": "array", "items": { "type": "string" } },
        "max_count": { "type": "integer", "minimum": 1, "maximum": 4, "description": "photo input only: max photos a submitter may attach (default 4). Header-level fields only — enforced by publishValidation.ts." },
        "required": { "type": "boolean" }
      }
    },
    "item": {
      "type": "object", "additionalProperties": false,
      "required": ["key", "label"],
      "properties": {
        "key": { "type": "string" }, "label": { "type": "string" },
        "kind": { "type": "string", "enum": ["rated", "numeric", "circle_one", "text"], "description": "rated = use the group scale (default); numeric/circle_one/text = special item per the source." },
        "options": { "type": "array", "items": { "type": "string" }, "description": "for circle_one items (e.g. fuel ['1/4','1/2','3/4','Full'])." },
        "scale": { "type": "array", "items": { "type": "string" }, "description": "per-item override of the group scale (e.g. a Yes/No question inside a group that elsewhere offers N/A)." },
        "comment": { "type": "boolean", "description": "per-item override of group comment_per_item." }
      }
    },
    "guidance_block": {
      "type": "object",
      "required": ["type"],
      "properties": { "type": { "type": "string", "enum": ["p", "bullets", "callout"] } },
      "oneOf": [
        {
          "additionalProperties": false, "required": ["type", "text"],
          "properties": { "type": { "const": "p" }, "text": { "type": "string", "minLength": 1 } }
        },
        {
          "additionalProperties": false, "required": ["type", "items"],
          "properties": { "type": { "const": "bullets" }, "items": { "type": "array", "minItems": 1, "maxItems": 250, "items": { "type": "string", "minLength": 1 } } }
        },
        {
          "additionalProperties": false, "required": ["type", "style", "text"],
          "properties": { "type": { "const": "callout" }, "style": { "type": "string", "enum": ["critical", "quality", "note"] }, "text": { "type": "string", "minLength": 1 } }
        }
      ]
    },
    "section": {
      "type": "object",
      "required": ["type"],
      "properties": { "type": { "type": "string", "enum": ["header", "static_text", "repeating_table", "signature_table", "checklist", "freeform", "content_blocks", "guidance", "form_link", "job_requirements", "expected_materials", "additional_photos"] } },
      "oneOf": [
        {
          "additionalProperties": false, "required": ["type", "fields"],
          "properties": { "type": { "const": "header" }, "title": { "type": "string" }, "fields": { "type": "array", "items": { "$ref": "#/$defs/field" } } }
        },
        {
          "additionalProperties": false, "required": ["type", "text"],
          "properties": { "type": { "const": "static_text" }, "text": { "type": "string" }, "emphasis": { "type": "string", "enum": ["footer", "heading", "legal"] } }
        },
        {
          "additionalProperties": false, "required": ["type", "key", "columns"],
          "properties": { "type": { "const": "repeating_table" }, "key": { "type": "string" }, "title": { "type": "string" }, "columns": { "type": "array", "items": { "$ref": "#/$defs/field" } }, "min_rows": { "type": "integer" }, "allow_add": { "type": "boolean" } }
        },
        {
          "additionalProperties": false, "required": ["type", "key", "columns"],
          "properties": { "type": { "const": "signature_table" }, "key": { "type": "string" }, "title": { "type": "string" }, "columns": { "type": "array", "items": { "$ref": "#/$defs/field" }, "description": "exactly one column must have input:signature" }, "min_rows": { "type": "integer" }, "allow_add": { "type": "boolean" } }
        },
        {
          "additionalProperties": false, "required": ["type", "key", "groups"],
          "properties": {
            "type": { "const": "checklist" }, "key": { "type": "string" }, "title": { "type": "string" },
            "groups": { "type": "array", "items": {
              "type": "object", "additionalProperties": false, "required": ["key", "label", "scale", "items"],
              "properties": { "key": { "type": "string" }, "label": { "type": "string" }, "scale": { "type": "array", "items": { "type": "string" }, "description": "response options, e.g. ['OK','NO','N/A']" }, "comment_per_item": { "type": "boolean" }, "items": { "type": "array", "items": { "$ref": "#/$defs/item" } } }
            } }
          }
        },
        {
          "additionalProperties": false, "required": ["type", "key", "label"],
          "properties": { "type": { "const": "freeform" }, "key": { "type": "string" }, "label": { "type": "string" }, "input": { "type": "string", "enum": ["textarea", "text"] } }
        },
        {
          "additionalProperties": false, "required": ["type", "key", "blocks"],
          "properties": { "type": { "const": "content_blocks" }, "key": { "type": "string" }, "title": { "type": "string" }, "source_pdf": { "type": "string" }, "blocks": { "type": "array", "items": { "type": "object", "additionalProperties": false, "required": ["body"], "properties": { "heading": { "type": "string" }, "body": { "type": "string" } } } } }
        },
        {
          "additionalProperties": false, "required": ["type", "heading", "blocks"],
          "properties": { "type": { "const": "guidance" }, "heading": { "type": "string", "minLength": 1 }, "blocks": { "type": "array", "minItems": 1, "items": { "$ref": "#/$defs/guidance_block" }, "description": "Read-only SOP/guidance rich text (SOP daily form, slice D1): paragraphs, bullet lists, and styled callouts — transcribed VERBATIM from the source document. Plain text only (no HTML); contributes NO submission value keys." } }
        },
        {
          "additionalProperties": false, "required": ["type", "label", "parent_form_code"],
          "properties": { "type": { "const": "form_link" }, "label": { "type": "string", "minLength": 1 }, "parent_form_code": { "type": "string", "pattern": "^[a-z0-9-]+$", "description": "The linked form-type parent (must exist in catalog.json — enforced by publishValidation.ts + tests/test_form_definitions.py; JSON Schema cannot cross-file check)." }, "helper": { "type": "string", "minLength": 1 } }
        },
        {
          "additionalProperties": false, "required": ["type", "key"],
          "properties": { "type": { "const": "job_requirements" }, "key": { "type": "string", "description": "The section's top-level value key — the manager's answers file under values.<key> = [{label, kind, response}] (self-describing; SOP daily form slice D4)." }, "title": { "type": "string" } },
          "description": "Per-job daily-form requirements placeholder (slice D4). Carries NO content of its own: at render time the portal fetches the job's admin-authored requirement items (D1 job_daily_requirements, migration 0030; edited on the Job Tracker job detail) and renders them here. AT MOST ONE per definition — enforced by publishValidation.ts (a second overlay mount would double-file the answers); JSON Schema cannot count across the sections array."
        },
        {
          "additionalProperties": false, "required": ["type", "key"],
          "properties": { "type": { "const": "expected_materials" }, "key": { "type": "string", "description": "Mount identity, RESERVED in the top-level value namespace (uniqueness-checked like every keyed section) but the section files NO values under it — receipt data lands in the deliveries_received table + the material-incident form's own submission (Material receipts M2)." }, "title": { "type": "string" } },
          "description": "Expected-materials receipt placeholder (Material receipts M2). Carries NO content of its own: at render time the Daily tab fetches the job's expected materials (D1 job_expected_materials, migration 0031, M1) and renders them here with 'Confirm receipt' / 'Report a problem' actions. Captures NO form values (self-describing filed PDFs stay stable); the confirm action appends a deliveries_received row instead. AT MOST ONE per definition — enforced by publishValidation.ts; JSON Schema cannot count across the sections array."
        },
        {
          "additionalProperties": false, "required": ["type", "key"],
          "properties": { "type": { "const": "additional_photos" }, "key": { "type": "string", "const": "additional_photos", "description": "MUST be the fixed wire key 'additional_photos' — /api/submit validates + CLAIMS values.additional_photos = [{pool_id, caption?}] (the daily-photo POOL references; worker/fieldops_daily_photos.ts). Enforced by publishValidation.ts." }, "title": { "type": "string" } },
          "description": "Additional-photos pool mount (DR-photo-pool Slice 1, 2026-07-03). Carries NO content of its own: the Daily tab renders the pool upload/status UI here — each additional photo uploads INDIVIDUALLY to daily_photo_pool (migration 0037; the inline site_photos field is payload-budgeted: CS2 280KB × 4 base64 < the 1.8MB payload cap, so more inline photos cannot ride the submission) and the submission files only tiny POOL REFERENCES under values.additional_photos. AT MOST ONE per definition — enforced by publishValidation.ts; JSON Schema cannot count across the sections array."
        }
      ]
    }
  }
}
