{
  "form_code": "incident-report-v2",
  "parent_form_code": "incident-report",
  "form_name": "Incident Report",
  "variant_label": null,
  "version": 2,
  "archetype": "sectioned_assessment",
  "source_pdf": "",
  "sections": [
    {
      "type": "header",
      "fields": [
        {
          "key": "location",
          "label": "Location",
          "input": "text",
          "required": true
        },
        {
          "key": "reported_by",
          "label": "Reported By",
          "input": "text",
          "required": true
        },
        {
          "key": "witness_name",
          "label": "Witness Name",
          "input": "text"
        }
      ]
    },
    {
      "type": "freeform",
      "key": "description",
      "label": "Description of Incident",
      "input": "textarea"
    },
    {
      "type": "signature_table",
      "key": "reporter_signoff",
      "columns": [
        {
          "key": "name",
          "label": "Name",
          "input": "text"
        },
        {
          "key": "signature",
          "label": "Signature",
          "input": "signature"
        }
      ],
      "min_rows": 1,
      "allow_add": true,
      "title": "Reporter Sign-Off"
    }
  ]
}
